,category_cluster,supplier_name,no_skus_WH,inv_count,inventory_value_usd,brand_1,brand_2,brand_3,payment_terms
0,FMCG,"IC_Sabang Merauke Jaya, PT_JNJ_CBD (Outright)",163,6082,11501.687,Johnson's,Listerine,Clean & Clear,Immediately
1,Lifestyle,"IC_Scommerce (Thailand) Co., Ltd. (Outright)",4,14,131.46986,Got7,JYP Entertainment,n.a.,30 NET
2,EL,ID_9.9 Supplier,590,5082,57948.73,Dauky,Logitech,Aukey,Immediately
3,FMCG,"ID_AMAN INDAH MAKMUR, PT",56,3456,7955.2007,Fluffy,Mamamia,n.a.,30 NET
4,EL,"ID_ANUGRAH NIAGATAMA PERKASA, PT",47,273,3756.8076,Sony,Philips,n.a.,30 NET
5,FMCG,"ID_Abadi Niaga Prima, PT",33,647,302.2131,Wong Coco,n.a.,n.a.,30 NET
6,FMCG,"ID_Acommerce Jaya Abadi, PT",164,7268,91889.69,SGM,Nutrilon,Nutribaby,21 NET
7,EL,"ID_Aditya Sarana Graha, PT",3,1,17.419516,Kirin,n.a.,n.a.,30 NET
8,EL,"ID_Aditya Sriwijaya, PT (Outright)",73,37210,103693.11,Philips,Broco,n.a.,30 NET
9,EL,"ID_Agres Info Tekhnologi,PT",26,65,4630.3667,HP,Hewlett-Packard,Asus,21 NET
10,FMCG,"ID_Ajinomoto Sales Indonesia, PT",53,0,0.0,Sajiku,Saori,Ajinomoto,14 NET
11,FMCG,"ID_Akasha Wira International, PT",8,1,2.60729,Pure Life,n.a.,n.a.,30 NET
12,EL,"ID_Alta Nikindo, PT",5,0,0.0,Nikon,n.a.,n.a.,30 NET
13,FMCG,"ID_Anggana Catur Prima, PT",95,5075,1788.4401,Koepoe-Koepoe,Dua Belibis,Koepoe Koepoe,30 NET
14,FMCG,"ID_Anugerah Pharmindo Lestari, PT",11,93,768.036,Jointfit,Mederma,Prive Uri-Cran,30 NET
15,FMCG,ID_Anugrah Argon Medika,24,452,10748.769,Friso,Frisolac,Frisomum Gold,21 NET
16,FMCG,"ID_Arira Pangindo, CV",16,609,361.0068,Kusuka,n.a.,n.a.,14 NET
17,FMCG,"ID_Armasco Prima, PT",117,0,0.0,Gullon,Osterberg,Jamie Oliver,30 NET
18,FMCG,"ID_Arum Nirwana Global, PT",14,319,590.03357,Tong Garden,Laverland,Manjun,30 NET
19,EL,"ID_Asean Teknologi Macindo, PT",6,6,442.98306,LG,Sony,n.a.,Immediately
20,FMCG,"ID_Asia Paramita Indah, PT",226,2338,7254.3184,Pixy,n.a.,n.a.,30 NET
21,FMCG,"ID_Asiasejahtera Perdana Pharmaceutical, PT",11,278,189.45975,You C1000,Yorkshire,n.a.,30 NET
22,FMCG,"ID_Astaguna Wisesa, PT",37,434,760.58124,Morin,n.a.,n.a.,30 NET
23,Lifestyle,"ID_Aston Housewares International, PT",384,0,0.0,Lucky Bird,Mila,n.a.,30 NET
24,EL,"ID_Astrindo Senayasa, PT",36,13910,51373.594,Sandisk,n.a.,n.a.,30 NET
25,EL,"ID_Atakindo Tunas Kharisma, PT",4,638,7561.1406,Simbadda,n.a.,n.a.,30 NET
26,FMCG,"ID_Austasia Food, PT",19,4825,2354.7615,Greenfields,Green Fields,n.a.,7 NET
27,EL,"ID_Axindo Infotama,PT",9,706,10302.795,Maxell,Audio-Technica,Jabra,30 NET
28,Lifestyle,"ID_BUDIRAYA TATAPRIMA, PT",21,310,230.35118,Superkifa,n.a.,n.a.,30 NET
29,FMCG,"ID_Bahtera Cipta Raga Prima, PT",61,1531,9273.52,Banana Boat,Schick,n.a.,30 NET
30,FMCG,"ID_Bahtera Wiraniaga Internusa, PT",88,3987,3530.7627,Pronas,Sriboga,n.a.,30 NET
31,EL,ID_Bangga Teknologi Indonesia,34,89,993.84515,Advan,n.a.,n.a.,30 NET
32,EL,"ID_Bangun Persada Tata Makmur, PT (Mobile Category)",25,1478,24749.771,Braun,Samsung,n.a.,14 NET
33,EL,"ID_Bangun Persada Tata Makmur,PT",14,1,133.64172,Sony,n.a.,n.a.,30 NET
34,EL,"ID_Bejana Nusa Agung, PT",5,176,2085.4478,Infinix,n.a.,n.a.,14 NET
35,FMCG,"ID_Benteng Persada Multindo, PT",32,6135,1694.2162,Bamboe,n.a.,n.a.,7 NET
36,FMCG,"ID_Berkah Maju Jaya, CV",11,387,179.98758,Papa,n.a.,n.a.,30 NET
37,FMCG,"ID_Berkat Unggultama Indonesia, PT",41,15,23.391315,Ayam Brand,Alce Nero,n.a.,30 NET
38,EL,"ID_Bhakti Idola Tama, PT",1,0,0.0,Miyako,n.a.,n.a.,30 NET
39,FMCG,"ID_Bina San Prima, PT",767,86072,600421.5,Nivea,Dettol,Enfagrow,30 NET
40,EL,"ID_Bintang Mahameru Utama, PT.",7,656,8926.104,Nokia,n.a.,n.a.,14 NET
41,EL,"ID_Bintang Mas Rezeki Nusantara, PT",17,0,0.0,Asus,Samsung,n.a.,30 NET
42,EL,"ID_Bintang Sahabat Sejati, PT",14,0,0.0,Samsung,n.a.,n.a.,14 NET
43,EL,"ID_Bintang Selular Indonesia,PT",6,586,10623.778,Nokia,Xiaomi,n.a.,14 NET
44,Fashion,"ID_Bolia Mitra Utama, PT (Outright)",8,158,3457.96,Shopee,n.a.,n.a.,30 NET
45,FMCG,"ID_Borwita Indah, PT",668,38788,282053.5,Pantene,Olay,Downy,14 NET
46,FMCG,"ID_Bukit Inti Makmur Abadi, PT",15,0,0.0,Pizzi,Sunco,n.a.,14 NET
47,FMCG,"ID_Burung Layang Terbang, CV",9,3,1.313158,Burung Layang Terbang,Cap Burung Layang Terbang,n.a.,30 NET
48,FMCG,"ID_Buyung Poetra Sembada, PT",6,0,0.0,Hoki,Topi Koki,BPS,30 NET
49,EL,"ID_CPUCOM DATA SYSTEM, PT",23,21,5819.959,Hewlett-Packard,HP,n.a.,30 NET
50,FMCG,"ID_CS2 Pola Sehat, PT",29,1134,111.89467,Teh Gelas,Vita,Crystalline,30 NET
51,Lifestyle,"ID_Cahaya Infra Persada, PT",149,1429,19712.393,YG Entertainment,Moonshot,Friso,Immediately
52,FMCG,"ID_Cahaya Inti Putra Sejahtera, PT",95,233,99.98014,ABC,Abc,Nescafe,30 NET
53,Lifestyle,"ID_Cahaya Perdana Plastics, PT",383,11241,9939.442,Lion Star,n.a.,n.a.,30 NET
54,EL,"ID_Catur Sukses Internasional, PT",63,7627,70222.33,Miyako,Maspion,Cosmos,30 NET
55,EL,"ID_Centrallindo Pratama Sejahtera, PT",14,0,0.0,Samsung,n.a.,n.a.,14 NET
56,FMCG,"ID_Citra Putra Tatapratama, PT",17,273,381.2743,Ladang Lima,Ladang Lima	,n.a.,30 NET
57,FMCG,"ID_Citraharum Inti Maju, CV",128,4461,1420.0656,Khong Guan,Monde,Nissin,21 NET
58,FMCG,"ID_Coca-Cola Distribution Indonesia, PT",83,2239,502.64136,Minute Maid,Frestea,Sprite,30 NET
59,EL,"ID_Complete Selular, CV",74,3424,417504.03,Samsung,Nokia,n.a.,14 NET
60,FMCG,"ID_Consfra Interguna Jaya, PT",24,613,23684.7,Calvin Klein,Bvlgari,Marc Jacobs,30 NET
61,EL,ID_DENPOO MANDIRI INDONESIA,8,152,4784.2827,Denpoo,n.a.,n.a.,30 NET
62,FMCG,"ID_DSG Surya Mas Indonesia, PT",4,137,737.62036,Certainty,n.a.,n.a.,21 NET
63,FMCG,"ID_DSG Surya Mas Trading Indonesia, PT",88,6961,30526.941,Fitti,Kira Kira,n.a.,30 NET
64,Lifestyle,"ID_DWIMITRA MULTI PRATAMA, PT",58,512,789.314,Emori,Glade,Cressol,30 NET
65,FMCG,"ID_Dalea Kreasi Nadisanti, PT",52,6,35.817272,Rollover Reaction,n.a.,n.a.,Immediately
66,EL,"ID_Datascrip, PT",172,3998,47022.44,Sandisk,Asus,Canon,30 NET
67,EL,"ID_Daya Wira Sarana, PT",31,0,0.0,Osram,n.a.,n.a.,Immediately
68,FMCG,"ID_Dewa Tunggal Abadi, PT",10,73,332.60565,Kokoku,Cantik Manis,An-Dong,30 NET
69,Lifestyle,"ID_Dinamika Maju Usaha, PT",29,531,514.9025,Total,Bukrim,Almeera,30 NET
70,FMCG,"ID_Dinamis Artha Sukses, PT",244,13761,23230.162,Nescafe,Milo,Nestle,30 NET
71,FMCG,"ID_Dinus Cipta Mandiri, PT",21,0,0.0,Chompchomp,n.a.,n.a.,30 NET
72,FMCG,"ID_Distribusi Surya Kencana, PT (Outright)",256,0,0.0,Bagus,Swallow,Swan,30 NET
73,FMCG,"ID_Distriversa Buanamas, PT",31,338,275.2679,Kokita,n.a.,n.a.,21 NET
74,FMCG,"ID_Dos Ni Roha, PT",397,1898,14638.633,Mustika Ratu,La Tulipe,LT Pro,30 NET
75,Lifestyle,"ID_Dua Berlian,PT",304,9656,8592.921,Glade,KIT,Mr Muscle,30 NET
76,FMCG,"ID_Duta Anugerah Abadi Indonesia Boga, PT",4,0,0.0,DAAI,n.a.,n.a.,Immediately
77,EL,"ID_Duta Sukses Indonesia, PT",8,0,0.0,Lexar,n.a.,n.a.,30 NET
78,EL,"ID_ECS Indo Jaya, PT (Outright)",94,1981,45020.44,Hewlett-Packard,Lenovo,Apple,30 NET
79,FMCG,"ID_Eakindo Mitra Sastari,PT",43,62,145.07317,Woh Hup,Ranong Tea,Gogi,30 NET
80,EL,"ID_Elite Asia Mobilkom, PT",8,3511,24313.67,Samsung,n.a.,n.a.,30 NET
81,FMCG,"ID_Elleair International Trading Indonesia, PT",27,1622,7806.737,Goo.N,n.a.,n.a.,30 NET
82,FMCG,ID_Eltean Luhurkencana,40,0,0.0,Sebamed,Sebclair,n.a.,Immediately
83,FMCG,"ID_Emporium Indonesia, PT",450,1,0.4548664,Indofood,Sos,Serena,14 NET
84,FMCG,"ID_Enseval Putera Megtrading, PT",35,117,103.46728,Love Juice,Samyang,Olatte,Immediately
85,FMCG,"ID_Esham Dima Mandiri, PT",56,1360,1020.08044,Julie's,Pokka,Realfit,21 NET
86,Lifestyle,"ID_Eskol Teguh Jaya, CV",164,13292,37678.7,Terry Palmer,Merah Putih,n.a.,30 NET
87,EL,"ID_Evercoss Technology Indonesia, PT",3,0,0.0,Genpro,n.a.,n.a.,30 NET
88,FMCG,ID_Evin Febriyanto,23,4713,3959.783,Maicih,Siumang,Manda,Immediately
89,FMCG,"ID_FKS MULTI AGRO, PT",1,0,0.0,Bola Deli,n.a.,n.a.,14 NET
90,FMCG,"ID_Fastrata Buana, PT",179,7202,5086.109,Kapal Api,Good Day,Mayasi,30 NET
91,FMCG,"ID_Filia Sukses Mandiri, PT",15,159,226.49739,Jatiluwih,Rasa Lokal,Healthy Bento,30 NET
92,FMCG,"ID_Fonterra Brands Indonesia, PT",49,11434,35735.71,Anlene,Anmum,Boneeto,30 NET
93,FMCG,"ID_Fortuna Grandis Indonesia, PT",18,256,1519.7434,Dalan D'Olive,Dalan D'olive,n.a.,30 NET
94,FMCG,"ID_Frisian Flag Indonesia,PT",155,8328,21450.34,Frisian Flag,Susu Bendera,Tidak Ada Merek,21 NET
95,EL,"ID_Fujifilm Indonesia, PT",24,338,10055.705,Fujifilm,Instax,n.a.,30 NET
96,EL,"ID_Galaxy Ion Technology, PT",63,4148,50603.613,Aukey,n.a.,n.a.,14 NET
97,FMCG,"ID_Global Jet Ecommerce, PT (Outright)",1,1,0.0,MamyPoko,n.a.,n.a.,14 NET
98,EL,"ID_Global Mitra Teknologi, PT",15,1,206.59737,LG,n.a.,n.a.,30 NET
99,FMCG,"ID_Gumindo Bogamanis, PT",7,155,78.41649,Rebo,n.a.,n.a.,30 NET
100,FMCG,"ID_Guna Layan Kuasa, PT",64,38,129.65697,JJ Royal Coffe,Gulaku,n.a.,14 NET
101,FMCG,"ID_Harapan Makmur, CV",39,1690,738.9108,Rose Brand,Best Water,A Satu,30 NET
102,EL,"ID_Harman Indonesia,PT",4,0,0.0,Edifier,n.a.,n.a.,30 NET
103,FMCG,"ID_Heavenly Nutrition Indonesia, PT",14,509,262.44583,Heavenly Blush,n.a.,n.a.,30 NET
104,EL,"ID_Helios Informatika Nusantara, PT",31,23,16369.105,Samsung,n.a.,n.a.,14 NET
105,FMCG,"ID_Hengan Global, PT",43,989,3494.3638,Anerle Cheris,Banitore,n.a.,30 NET
106,FMCG,ID_Heonz Royal Jaya,5,0,0.0,Samyang,n.a.,n.a.,30 NET
107,FMCG,"ID_Herbana Sehat Prima, PT",30,814,4879.1167,Herbana,n.a.,n.a.,30 NET
108,Lifestyle,"ID_Homeco Victoria Makmur, PT (Outright)",253,5511,13750.505,Technoplast,Wiggle,n.a.,30 NET
109,EL,"ID_Icool International Indonesia, PT ( Outright)",68,998,3016.813,Honor,Pepsodent,LUX,7 NET
110,FMCG,"ID_Idmarco Perkasa Indonesia, PT",601,8464,2930.6697,Indofood,Indomilk,Chitato,14 NET
111,EL,"ID_Indo Pasifik Teknologi, PT",12,850,103404.375,Honor,n.a.,n.a.,7 NET
112,EL,"ID_Indodigital Bintang Cemerlang,PT",20,30,767.39044,Fujifilm,Instax,n.a.,30 NET
113,FMCG,"ID_Indokharisma Pangan Semesta, PT",5,2128,3981.4949,Totole,n.a.,n.a.,30 NET
114,FMCG,ID_Indospirit Natura,4,297,1840.7915,Bragg,n.a.,n.a.,21 NET
115,FMCG,"ID_Interfood Sukses Jasindo,PT",65,1164,798.42883,Naraya,Alfredo,Apollo,30 NET
116,FMCG,"ID_Inti Cakrawala Citra,PT",357,5,0.93588114,Glade,Monde,Attack,Immediately
117,EL,"ID_Inti Megah Swara, PT",21,14019,122814.24,JBL,n.a.,n.a.,30 NET
118,FMCG,"ID_Inti Wahana Nusantara, PT",9,207,171.73338,Bola Deli,Bola,n.a.,30 NET
119,Lifestyle,"ID_Intrasari Raya,PT",268,9758,10633.427,Stella,HIT,Mitu,30 NET
120,EL,ID_Istana Argo Kencana,26,223,14623.378,Sanken,n.a.,n.a.,30 NET
121,Fashion,ID_JBS Textile Group A/S,106,121,1063.0493,CR7 Underwear,CR7,Cr7,Immediately
122,FMCG,"ID_Jalur Sutramas, PT",153,0,0.0,Roma,Migelas,Kis,7 NET
123,FMCG,"ID_Jenindo Prakarsa,PT",70,2,13.638113,Sweety,Vanish,Harpic,30 NET
124,EL,"ID_Jessica dan Justin, PT",31,0,0.0,Apple,n.a.,n.a.,14 NET
125,FMCG,ID_Jico Agung,128,356,555.41815,Daesang,Mamasuka,MAMASUKA,21 NET
126,FMCG,"ID_Jiwoone, PT",54,1061,889.70575,Missha,Promune,Cherimoa,30 NET
127,Lifestyle,"ID_Joenoes Ikamulya,PT",140,3971,4375.809,Yuri,Porstex,Biosoft,30 NET
128,EL,"ID_Jojo Optima Solusindo, PT",14,8,1278.0206,Coocaa,TCL,Samsung,30 NET
129,FMCG,"ID_Joliv Jaya Abadi, PT",100,0,0.0,MamyPoko,Goo.N,Dancow,Immediately
130,FMCG,"ID_Juarindo Sejahtera Mandiri, CV",9,22,82.16487,Gloria,Indobon,n.a.,14 NET
131,FMCG,ID_Kaifa Indonesia,40,69,235.46648,Hunts,Kkoh Shaem Honey,Swiss Miss,30 NET
132,FMCG,ID_Kao Indonesia,210,22572,81069.12,Biore,Laurier,Merries,30 NET
133,FMCG,"ID_Kara Santan Pertama, PT",5,601,384.06787,Kara,n.a.,n.a.,30 NET
134,FMCG,"ID_Kartikawira Adisukses, PT",161,2687,7892.156,Camel,Remia,Cavendish&Harvey,30 NET
135,Fashion,"ID_Karunia Berlian Makmur, PT",25,4,77.60394,Realme,n.a.,n.a.,Immediately
136,FMCG,"ID_Karunia Sukses Gemilang, PT",321,6028,12866.42,Jay's,Cirio,Mr. Food,30 NET
137,Lifestyle,"ID_Kedaung Sentra Distribusi, PT",144,50913,81277.42,Kedaung,Superdoll,n.a.,30 NET
138,FMCG,"ID_Kimberly-Clark Indonesia,PT",58,8345,13708.498,Kotex,Huggies,n.a.,14 NET
139,FMCG,"ID_Kino Ecomm Solusindo, PT",164,2074,4482.9966,Cap Kaki Tiga,Ovale,Eskulin,30 NET
140,Lifestyle,"ID_Kirana Pacifik Luas, PT",192,0,0.0,Claris,n.a.,n.a.,30 NET
141,FMCG,"ID_Koneksia Niaga Solusindo,PT",137,2323,5443.504,Enfagrow,Nyam-Nyam,Good Time,30 NET
142,FMCG,"ID_Kurnia Tirta Sembada, PT",17,5,12.5751,2tang,zestea,Zegar,30 NET
143,EL,"ID_LG Electronics Indonesia, PT",56,25,3087.4702,LG,olympus,n.a.,30 NET
144,FMCG,"ID_LSHR Jakarta, PT",12,93,37.05233,Ichitan,Yeo's,Red Bull,30 NET
145,FMCG,ID_Loreal Indonesia,2622,106313,605367.25,NYX,L'Oreal Paris,Maybelline,30 NET
146,FMCG,"ID_Lotte Shopping Indonesia, PT",1037,991,1223.4047,Choice L,ABC,Dua Kelinci,Immediately
147,FMCG,ID_MMM Sejahtera,63,0,0.0,Sukro,Dua Kelinci,Nutrijell,30 NET
148,FMCG,"ID_Madu Murni Nusantara, PT",20,70,405.25745,Madu Nusantara,n.a.,n.a.,15 NET
149,Lifestyle,"ID_Makmur Prima Trading, PT (Outright)",117,1731,19131.385,Bolde,Bolde Super Hoover,n.a.,30 NET
150,FMCG,"ID_Malindo Sukses, PT",22,112,147.57121,Munchy's,Lexus,Omypop,30 NET
151,FMCG,"ID_Marga Nusantara Jaya, PT",91,1222,557.2533,Nano-Nano,Tini Wini Biti,Frozz,30 NET
152,FMCG,"ID_Martina Berto, PT",122,0,0.0,PAC,Mirabella,Dewi Sri Spa,30 NET
153,EL,ID_Maspion Bazar,2,2,19.833084,Maspion,n.a.,n.a.,14 NET
154,FMCG,"ID_Masuya  Graha Trikencana, PT",260,0,0.0,Hinode Mirin,Nissin,Premier Salute,30 NET
155,FMCG,"ID_Mawar Jaya, PT",23,925,650.32153,Mawar Jaya,Mawar,n.a.,14 NET
156,FMCG,"ID_Maya Muncar, PT",16,27,26.005312,Maya,n.a.,n.a.,14 NET
157,FMCG,"ID_Mega Intra Sejahtera, PT",9,652,1688.4147,Neppi,Cotton Tree,n.a.,30 NET
158,EL,"ID_Megatama Gemilang Sakti, PT",32,3176,6264.3735,Uticon,Vetto,Regency,30 NET
159,FMCG,"ID_Metta Sinar Sejahtera, PT",32,0,0.0,Oishi,Swallow Globe Brand,Botan,30 NET
160,FMCG,"ID_Miin Kosmetika Indonesia, PT",54,15,142.97488,Missha,n.a.,n.a.,14 NET
161,EL,ID_Mitra Internasional Indonesia,193,61,7773.027,Xiaomi,Pocophone,n.a.,Immediately
162,FMCG,"ID_Mitra Jayapersada, PT",16,1328,746.9512,Luwak,n.a.,n.a.,14 NET
163,FMCG,"ID_Mitra Sarana Purnama, PT",101,7501,6463.402,Delmonte,Marjan,Maestro,21 NET
164,EL,ID_Mitra Satu Abadi,95,487,111055.92,Vivo,n.a.,n.a.,30 NET
165,EL,"ID_Multi Eltekindo Cemerlang, CV",2,0,0.0,Sony,n.a.,n.a.,30 NET
166,EL,"ID_Multi Indocipta Nugraha, PT",12,779,26268.518,Yong Ma,n.a.,n.a.,30 NET
167,FMCG,"ID_Multitrend Indonesia, PT",8,0,0.0,Aveeno,n.a.,n.a.,Immediately
168,FMCG,"ID_Multiutama Disposindo Jaya, PT",31,1012,415.49567,Skrineer,Diapro,n.a.,30 NET
169,FMCG,"ID_Niaga Harmoni Indonesia, PT",7,0,0.0,Suyuke,Kece,Krukan,30 NET
170,FMCG,"ID_Niaga Mitra Abadi, PT",12,458,5003.9834,Nepia Genki,Cotton Tree,n.a.,30 NET
171,EL,"ID_Niko Elektronik Indonesia,PT",29,732,5225.9136,Niko,n.a.,n.a.,30 NET
172,FMCG,"ID_Niramas Utama, PT",34,2506,761.0302,Inaco,I'm Coco,n.a.,30 NET
173,FMCG,"ID_Nirmala Pangan Sejahtera, PT",15,1,0.41514823,Blue Band,n.a.,n.a.,30 NET
174,FMCG,"ID_Nirwana Lestari,PT",412,11609,8738.257,Delfi,Kellogg's,Silver Queen,7 NET
175,FMCG,"ID_Nutragen Global Esana, PT",24,483,140.8043,Fastbite,Gofress,Magnuzz,30 NET
176,EL,"ID_Option Sukses Jaya, CV",35,0,0.0,Oppo,Samsung,n.a.,14 NET
177,Lifestyle,ID_Origra.Co (Outright),16,60,283.89865,Shopee,n.a.,n.a.,Immediately
178,FMCG,"ID_PRAMBANAN KENCANA, PT",167,2486,5819.769,Borges,Mr.P,Happy Day,30 NET
179,Lifestyle,ID_PT Graha Bumi Hijau,40,5097,3513.8213,Tessa,Multi,n.a.,14 NET
180,EL,"ID_Panasonic Gobel Eco Solutions Sales Indonesia, PT",9,0,0.0,Panasonic,n.a.,n.a.,30 NET
181,EL,ID_Panasonic Gobel Indonesia,34,19,937.1305,Panasonic,n.a.,n.a.,30 NET
182,EL,"ID_Panasonic Gobel Life Solutions Sales Indonesia, PT",12,6814,9216.629,Panasonic,n.a.,n.a.,30 NET
183,FMCG,"ID_Pandurasa Kharisma, PT",76,1845,6196.299,Lorenz,Zaini,Hero,30 NET
184,FMCG,"ID_Pangan Lestari, PT",87,3195,3432.506,Finna,Kewpie,Sun Bell,14 NET
185,Lifestyle,"ID_Panti Kosmetika Baru, PT",53,9295,10330.809,Paseo,Nice,Jolly,14 NET
186,FMCG,"ID_Paragon Technology and Innovation, PT",604,25132,84166.37,Make Over,Emina,n.a.,30 NET
187,EL,"ID_Paron Indonesia, PT",1,9,498.71652,Lenovo,n.a.,n.a.,Immediately
188,EL,ID_Pasifik Internusa,2,0,0.0,Samsung,n.a.,n.a.,30 NET
189,Lifestyle,"ID_Peace Global Sukses, PT",5,78,54.66402,B29,n.a.,n.a.,14 NET
190,EL,"ID_Philips Indonesia Commercial,PT",371,11055,206517.14,Philips,Philipis,Avent,14 NET
191,EL,"ID_Philips Inonesia, PT",6,0,0.0,Philips,n.a.,n.a.,30 NET
192,EL,ID_Pixel Perdana Jaya,17,36,5196.4185,Aqua,Philips,Sharp,30 NET
193,FMCG,"ID_Pondan Pangan Makmur Indonesia, PT",98,2735,2814.7168,Pondan,Unifood,n.a.,30 NET
194,FMCG,"ID_Primasari Eterna, PT",122,0,0.0,Jelly Belly,Hershey's,Ice Breakers,30 NET
195,Others,"ID_Prokemas Adhikari Kreasi, PT (Outright)",3,0,0.0,Shopee,n.a.,n.a.,Immediately
196,FMCG,"ID_Puri Oriental Lestari, PT",54,0,0.0,Beryl's,n.a.,n.a.,Immediately
197,FMCG,"ID_REMBAKA, PT",199,3552,12437.84,La Tulipe,LT Pro,n.a.,30 NET
198,FMCG,"ID_Raksasa Bisnis Indonesia, PT",71,5217,920.11115,Sasa,Meg Cheddar,n.a.,30 NET
199,Lifestyle,"ID_Rama Putra,PT",59,6986,18409.06,Vanish,Harpic,n.a.,30 NET
200,FMCG,"ID_Rejeki Tujuh Alam,PT",3,0,0.0,Madu Uray,n.a.,n.a.,14 NET
201,EL,ID_SABANG MERAUKE JAYA_SEIN_TOP30DAYS,198,8769,989904.75,Samsung,n.a.,n.a.,30 NET
202,FMCG,ID_SBS Supplier,154,2890,9387.939,Samsung,Uneed,Asus,Immediately
203,Lifestyle,"ID_SURYA PASIFIK SEJAHTERA, PT",477,21486,21942.309,Hawaii,n.a.,n.a.,30 NET
204,EL,"ID_Sabang Merauke Jaya, PT_SEIN_TOP7DAYS",75,856,393207.78,Samsung,n.a.,n.a.,Immediately
205,FMCG,"ID_Salim Ivomas Pratama,PT",4,0,0.0,Bimoli,n.a.,n.a.,14 NET
206,EL,"ID_Samsung Electronics Indonesia, PT",193,9142,9407.427,Samsung,tachyon,n.a.,Immediately
207,FMCG,"ID_Sarana Abadi Makmur Bersama, PT",117,15943,3458.8613,Taro,Vape,Oreo,14 NET
208,EL,"ID_Sarana Kencana Mulya, PT",6,0,0.0,Polytron,n.a.,n.a.,30 NET
209,FMCG,"ID_Sari Agrotama Persada, PT",24,655,937.1827,Sania,Fortune,Olivoila,21 NET
210,FMCG,"ID_Sarimunik Mandiri, PT",40,0,0.0,Munik,n.a.,n.a.,Immediately
211,Lifestyle,"ID_Sayap Mas Utama, PT",717,33158,29693.457,So Klin,Kodomo,Emeron,21 NET
212,FMCG,"ID_Sca Hygiene Indonesia, PT",57,817,4262.283,Drypers,n.a.,n.a.,30 NET
213,FMCG,"ID_Sekawan Karsa Mulia, PT",12,158,110.13824,Dyna,Pasha,Dynakat,30 NET
214,EL,"ID_Selaras Makmur Sejati, PT",4,0,0.0,Micropack,n.a.,n.a.,30 NET
215,FMCG,"ID_Selatan Jaya Makmur, PT",69,10891,2544.7607,Hatari,Kobe,Fox's,21 NET
216,EL,ID_Sentra Inti Pratama,16,2276,30472.879,Samsung,Nokia,n.a.,14 NET
217,FMCG,"ID_Serena Cafetaria Rasa, PT",29,0,0.0,Khong Guan,Ozlo,Serena,Immediately
218,EL,"ID_Setia Utama Distrindo, PT",2,0,0.0,Samsung,n.a.,n.a.,14 NET
219,FMCG,"ID_Sewu Segar Nusantara, PT",9,421,260.84875,Duta,DUTA,n.a.,14 NET
220,FMCG,"ID_Shafco Multi Trading, PT",118,838,2418.6218,Zoya Cosmetics,n.a.,n.a.,30 NET
221,EL,ID_Sharp Electronics Indonesia,61,250,11656.186,Sharp,Philips,n.a.,30 NET
222,Lifestyle,ID_Shebishop,41,854,1.5111712,Shopee,n.a.,n.a.,Immediately
223,EL,"ID_Signify Commercial Indonesia, PT",26,532,3185.7866,Philips,n.a.,n.a.,30 NET
224,EL,"ID_Sinar Bintang Nusantara, PT",10,11,304.61102,Ichiko,n.a.,n.a.,30 NET
225,Fashion,"ID_Sinar Central Perkasa,PT",2,271,1241.2815,Shopee,n.a.,n.a.,30 NET
226,EL,"ID_Sinar Cerdas Cakrawala, PT (Outright)",5,2067,8228.626,Lenovo,Sandisk,n.a.,7 NET
227,FMCG,"ID_Sinar Kencana Agung, PT",7,671,380.16534,Happy Tos,n.a.,n.a.,14 NET
228,FMCG,"ID_Sinar Niaga Sejahtera, PT",243,884,820.48206,Garuda,Gery,Chocolatos,30 NET
229,FMCG,"ID_Sinar Sosro, PT",83,0,0.0,Fruit Tea,Country Choice,Teh Botol Sosro,Immediately
230,FMCG,"ID_Sinarmas Distribusi Nusantara, PT",52,7,15.581941,Haan,Colatta,Filma,14 NET
231,EL,"ID_Sinarmulia Sukses Makmur, PT",25,806,7072.1943,Hewlett-Packard,HP,n.a.,30 NET
232,FMCG,"ID_Sinergi Ber Tiga,PT",10,0,0.0,Moiaa,Royale,n.a.,30 NET
233,FMCG,"ID_Sinergi Multi Distrindo, PT",406,3607,10274.367,Pigeon,n.a.,n.a.,30 NET
234,EL,"ID_Sinergi Sukses Mobilindo, PT",11,0,0.0,Samsung,n.a.,n.a.,14 NET
235,EL,"ID_Skyworth Indonesia,PT",1,0,0.0,Coocaa,n.a.,n.a.,30 NET
236,FMCG,"ID_Softex Indonesia, PT",110,4292,16780.588,Sweety,Softex,Confidence,30 NET
237,FMCG,"ID_Solusky,PT (Niko)",2,0,0.0,Skygoat,n.a.,n.a.,30 NET
238,EL,ID_Star Cosmos,55,1229,20182.654,Cosmos,n.a.,n.a.,30 NET
239,EL,"ID_Subur Semesta, PT (Outright)",10,254,2471.288,CMOS,n.a.,n.a.,30 NET
240,FMCG,"ID_Sukanda Djaya, PT",297,11732,14890.455,Lee Kum Kee,San Remo,Vinisi,30 NET
241,FMCG,"ID_Sumber Rejeki, CV",12,0,0.0,Maicih,n.a.,n.a.,30 NET
242,EL,"ID_Surya Candra, PT",6,0,0.0,Logitech,n.a.,n.a.,30 NET
243,FMCG,"ID_Surya Lintas Nusantara,PT",61,11,102.56355,Olay,Gilette,OLAY,14 NET
244,FMCG,"ID_Surya Makmur Universal, PT",13,4820,2850.0886,Regal,n.a.,n.a.,21 NET
245,Lifestyle,"ID_Surya Pelangi Nusantara Sejahtera, PT (Outright)",468,16798,15623.259,Green Leaf,Greenleaf,n.a.,30 NET
246,FMCG,"ID_Surya Pratista Hutama, PT",4,0,0.0,Burung Dara,n.a.,n.a.,30 NET
247,EL,"ID_Svarna Dipa, PT",36,123,14127.717,Sharp,Polytron,Aqua,30 NET
248,EL,"ID_Synnex Metrodata Indonesia, PT",152,591,54952.363,Asus,Hewlett-Packard,Lenovo,30 NET
249,FMCG,"ID_TTS Abadi, PT",258,2291,3416.728,SW,Mama,Mae Pranom,30 NET
250,FMCG,"ID_Tata Global Sentosa, PT",68,8269,25552.654,Pokana,Mom Baby,n.a.,14 NET
251,EL,"ID_Tele Global Indo, PT",35,1,332.47754,Samsung,n.a.,n.a.,14 NET
252,EL,"ID_Teletama Artha Mandiri, PT",36,113,33161.473,Asus,Apple,Xiaomi,14 NET
253,FMCG,"ID_Tempo,PT",80,294,608.112,Bebelac,Bebelove,Tidak Ada Merek,14 NET
254,FMCG,"ID_Tiga Sedulur Djaja, PT",2,0,0.0,Sumo,n.a.,n.a.,14 NET
255,FMCG,"ID_Tigaraksa Satria,PT",241,19645,45472.848,Colgate,Quaker,Palmolive,14 NET
256,EL,"ID_Tipa Arena Citra, PT",33,12,9818.561,Asus,Hewlett-Packard,HP,30 NET
257,FMCG,"ID_Tirta Investama, PT (Outright)",26,0,0.0,Aqua,Mizone,Vit Levite,14 NET
258,EL,"ID_Tixpro Informatika Megah, PT",31,162,11338.926,Logitech,Dell,Samsung,30 NET
259,EL,"ID_Tripacific Electrindo, PT",37,287,2330.416,Sekai,Panasonic,Niko,30 NET
260,Lifestyle,"ID_Triratna Sukses Sejahtera, PT",84,1705,1072.7736,Onyx,n.a.,n.a.,30 NET
261,FMCG,"ID_Tumbakmas Niagasakti, PT",45,0,0.0,Sasa,Meg Cheddar,Meg Keju,30 NET
262,FMCG,"ID_Ultra Prima Abadi, PT",108,4,0.9992263,Formula,Tango,Fullo,14 NET
263,FMCG,"ID_Uni Indo Utama, PT",89,647,1206.2277,Klinsen,Dayman,Nike,30 NET
264,FMCG,"ID_Unigemilang Sentosa, PT",2,0,0.0,Tropical,n.a.,n.a.,14 NET
265,FMCG,"ID_Unilever Enterprises Indonesia, PT",320,3845,33138.543,Lakme,Lakmeindo,n.a.,30 NET
266,FMCG,"ID_Unilever Indonesia, PT",2046,360525,743551.4,Pond's,Dove,Lifebuoy,30 NET
267,FMCG,"ID_Unirama Duta Niaga, PT",44,22900,87101.625,St.Ives,Dove,Vaseline,30 NET
268,Lifestyle,"ID_Unitama Sari Mas, PT",55,385,347.5093,Dahlia,Freshgo,Kiriko,30 NET
269,FMCG,"ID_United Harvest Indonesia, PT",17,746,1091.8988,Jolly Time,Papatonk,O'Garlos,Immediately
270,FMCG,"ID_Unza Vitalis, PT",237,18714,91362.664,Safi,Enchanteur,Bio Essence,30 NET
271,EL,"ID_Visimoda Andalan, PT",4,4,19.730844,Takara,n.a.,n.a.,30 NET
272,FMCG,"ID_WINIDA AYU LESTARI, PT",226,2148,2415.3713,Just Miss,n.a.,n.a.,30 NET
273,FMCG,"ID_WINIDA LESTARI INTERNATIONAL, PT",73,3921,3363.6296,Just Miss,n.a.,n.a.,30 NET
274,EL,"ID_Wahana Bersama Abadi, PT",19,23,2780.2559,Panasonic,Daikin,Toshiba,30 NET
275,FMCG,"ID_Walla Tritunggal, PT",19,448,3171.1028,Mane 'N Tail,Namu Life,Snail White,30 NET
276,Lifestyle,"ID_Wateru Natural Alkalindo, PT",5,268,120.61357,Eternalplus,Wateru,n.a.,30 NET
277,FMCG,"ID_Wicaksana Overseas International, PT",42,3605,8051.0957,Gaga,Pears,LUX,30 NET
278,EL,"ID_X-com Media, CV",30,30,106.8861,Philips,Seagate,Epson,30 NET
279,EL,"ID_XDC Indonesia, PT",7,0,0.0,Lenovo,HP,n.a.,30 NET
