,category_cluster,supplier_name,no_skus_WH,inv_count,inventory_value_usd,brand_1,brand_2,brand_3,payment_terms
235,FMCG,VN_HỘ KINH DOANH LÊ BÁ NGỌC_Outright,5,0,0.0,LOCK&LOCK,Muji,No Brand,15 NET
236,Lifestyle,VN_Hộ Kinh Doanh Phạm Văn Tú_ Outright,28,2293,6975.4717,B&Q,n.a.,n.a.,30 NET
237,FMCG,VN_Hợp tác xã thương mại Quận 3(Tricoop)_Outright,715,56,29.457848,POND'S,Dove,Clear,10 NET
238,Fashion,VN_JBS Textile Group A/S_ Outright,88,0,0.0,CR7,n.a.,n.a.,30 NET
239,Fashion,VN_NGUYỄN TẤN TÀI_Outright,122,511,2617.7842,Lata,LATA,Yuumy,10 NET
240,Lifestyle,VN_NHÀ SÁCH SAO MAI_Outright,953,2058,2297.4343,Nhiều tác giả,n.a.,n.a.,30 NET
241,FMCG,VN_TAISUN VIET NAM_Outright,454,2822,29964.5,UniDry,Unifresh,Goodry,30 NET
242,Lifestyle,VN_VIỆN QUẢN LÝ P.A.C.E_Outright,19,917,3019.6772,n.a.,n.a.,n.a.,30 NET
243,EL,VN_Warehouse VN_Outright,84,0,0.0,Maybelline New York,mades,Skinfood,30 NET
244,EL,VN_công ty TNHH MTV -SẢN XUẤT-THƯƠNG MẠI-DỊCH VỤ DTR_Outright,17,3163,26198.133,Energizer,n.a.,n.a.,21 NET
245,FMCG,vn_Công ty TNHH Thương Mại Song Hằng_outright,184,938,4654.923,Tag,PANTENE,Head and Shoulders,30 NET
